{
  "protocol": "tokenless.internal.web-ai-interaction-protocol/v0",
  "turnRef": "turn:44444444444444444444444444444444",
  "providerRef": "provider:11111111111111111111111111111111",
  "providerBindingRef": "binding:22222222222222222222222222222222",
  "conversationRef": "conversation:33333333333333333333333333333333",
  "lifecycle": "succeeded",
  "dispatchCertainty": "dispatched",
  "attachmentDelivery": {
    "status": "delivered",
    "attachmentRef": "attachment:55555555555555555555555555555555",
    "sha256": "d30f5f0bcb4a8d96f338fbb6df50e0fe9ea5383688e2c1b9d4bbbf5f5be664cc"
  },
  "result": {
    "text": "The supplied material is summarized.",
    "citations": [{
      "url": "https://example.invalid/source",
      "title": "Example source"
    }]
  }
}
